{
  "$schema": "./config.schema.json",
  "groups": [
    {
      "ledColor": "green",
      "name": "Atrium",
      "onCommand": "i2cset -y 1 0x10 0x02 0xFF",
      "offCommand": "i2cset -y 1 0x10 0x02 0x00",
      "dependsOn": [
        "Video"
      ]
    },
    {
      "ledColor": "orange",
      "name": "Sanctuary",
      "onCommand": "i2cset -y 1 0x10 0x03 0xFF",
      "offCommand": "i2cset -y 1 0x10 0x03 0x00",
      "dependsOn": [
        "Video"
      ]
    },
    {
      "name": "Video"
    },
    {
      "ledColor": "blue",
      "name": "Camera",
      "onCommand": "i2cset -y 1 0x10 0x01 0xFF",
      "offCommand": "i2cset -y 1 0x10 0x01 0x00"
    },
    {
      "ledColor": "white",
      "name": "Hazer",
      "onCommand": "i2cset -y 1 0x11 0x01 0xFF",
      "offCommand": "i2cset -y 1 0x11 0x01 0x00"
    },
    {
      "ledColor": "red",
      "name": "Light",
      "onCommand": "i2cset -y 1 0x10 0x04 0xFF",
      "offCommand": "i2cset -y 1 0x10 0x04 0x00"
    }
  ],
  "discoveredDeviceCustomizations": {
    "Hazer Machine": {
      "delayOnSeconds": 5
    },
    "Atrium Bldg Atlona TX 1": {
      "delayOffSeconds": 10
    },
    "Atrium Bldg Atlona TX 2": {
      "delayOffSeconds": 10
    },
    "Sanctuary Atlona TX": {
      "delayOffSeconds": 10
    }
  },
  "scanSubnets": [
    "10.1.32"
  ],
  "apcPDUs": [
    "10.1.32.101",
    "10.1.32.102",
    "10.1.32.103",
    "10.1.32.104",
    "10.1.32.105",
    "10.1.32.106",
    "10.1.32.107",
    "10.1.32.112",
    "10.1.32.113"
  ],
  "tpLinkKasaDevices": [
    "10.1.6.203",
    "10.1.6.204",
    "10.1.6.205",
    "10.1.6.206",
    "10.1.6.207"
  ],
  "manualDevices": [
    {
      "name": "Sanctuary Confidence TVs",
      "onCommand": "curl --retry 5 http://10.1.33.123/aj.html\\?a\\=command\\&cmd\\=TrigCEC\\&p1\\=on",
      "offCommand": "curl --retry 5 http://10.1.33.123/aj.html\\?a\\=command\\&cmd\\=TrigCEC\\&p1\\=off",
      "delayOnSeconds": 20
    },
    {
      "name": "Atrium Building TVs 2",
      "onCommand": "curl --retry 5 http://10.1.33.125/aj.html\\?a\\=command\\&cmd\\=TrigCEC\\&p1\\=on",
      "offCommand": "curl --retry 5 http://10.1.33.125/aj.html\\?a\\=command\\&cmd\\=TrigCEC\\&p1\\=off",
      "delayOnSeconds": 20
    },
    {
      "name": "Sanctuary Audience TVs",
      "onCommand": "curl --retry 5 http://10.1.33.124/aj.html\\?a\\=command\\&cmd\\=TrigCEC\\&p1\\=on",
      "offCommand": "curl --retry 5 http://10.1.33.124/aj.html\\?a\\=command\\&cmd\\=TrigCEC\\&p1\\=off",
      "delayOnSeconds": 20
    },
    {
      "name": "PTZ Left Camera",
      "onCommand": "python -c \"import socket; socket.socket(socket.AF_INET, socket.SOCK_DGRAM).sendto(bytes([0x81, 0x01, 0x04, 0x00, 0x02, 0xFF]), ('10.1.34.55', 1259))\"",
      "offCommand": "python -c \"import socket; socket.socket(socket.AF_INET, socket.SOCK_DGRAM).sendto(bytes([0x81, 0x01, 0x04, 0x00, 0x03, 0xFF]), ('10.1.34.55', 1259))\""
    },
    {
      "name": "PTZ Right Camera",
      "onCommand": "python -c \"import socket; socket.socket(socket.AF_INET, socket.SOCK_DGRAM).sendto(bytes([0x81, 0x01, 0x04, 0x00, 0x02, 0xFF]), ('10.1.34.56', 1259))\"",
      "offCommand": "python -c \"import socket; socket.socket(socket.AF_INET, socket.SOCK_DGRAM).sendto(bytes([0x81, 0x01, 0x04, 0x00, 0x03, 0xFF]), ('10.1.34.56', 1259))\""
    }
  ],
  "gpio": [
    {
      "group": "Hazer",
      "color": "white",
      "pin": 18,
      "bcmPin": 24,
      "mode": "switch",
      "pull": "down"
    },
    {
      "group": "Light",
      "color": "red",
      "pin": 11,
      "bcmPin": 17,
      "mode": "switch",
      "pull": "down"
    },
    {
      "group": "Camera",
      "color": "blue",
      "pin": 16,
      "bcmPin": 23,
      "mode": "switch",
      "pull": "down"
    },
    {
      "group": "Atrium",
      "color": "green",
      "pin": 15,
      "bcmPin": 22,
      "mode": "switch",
      "pull": "down"
    },
    {
      "group": "Sanctuary",
      "color": "orange",
      "pin": 13,
      "bcmPin": 27,
      "mode": "switch",
      "pull": "down"
    }
  ],
  "specialActions": [
    {
      "name": "Sound System Trigger",
      "onCommand": "i2cset -y 1 0x11 0x02 0xFF",
      "offCommand": "i2cset -y 1 0x11 0x02 0x00",
      "autoOffAfterSeconds": 1
    }
  ],
  "schedules": [
    {
      "time": "00:00",
      "action": "off",
      "groups": [
        "Atrium",
        "Sanctuary",
        "Video",
        "Camera",
        "Hazer",
        "Light"
      ],
      "disabled": false
    }
  ]
}